[
  {
    "id": "amp-harmeet-dhillon-2098925135302476136",
    "entity_type": "person",
    "entity_name": "Harmeet K. Dhillon",
    "role": "Assistant Attorney General for Civil Rights",
    "organization": "U.S. Department of Justice",
    "category": "government",
    "action": "quote_post",
    "date": "2026-09-13",
    "platform": "x",
    "account": "@AAGDhillon",
    "evidence_url": "https://x.com/AAGDhillon/status/2098925135302476136",
    "related_post_id": "post-layoffai-2098762091423203710",
    "country": "US",
    "featured": true,
    "portrait": null,
    "notes": "Public mirrors and LayoffHedge press page show Dhillon quote-posting the Trine University / Day 1 CPT material.",
    "status": "verified",
    "verified_at": "2026-09-16"
  },
  {
    "id": "amp-uslaborig-2098815611572728012",
    "entity_type": "organization",
    "entity_name": "U.S. Department of Labor Office of Inspector General",
    "role": "Federal oversight and law-enforcement office",
    "organization": "U.S. Department of Labor",
    "category": "government",
    "action": "quote_post",
    "date": "2026-09-12",
    "platform": "x",
    "account": "@USLaborIG",
    "evidence_url": "https://x.com/USLaborIG/status/2098815611572728012",
    "related_post_id": "post-layoffai-2098762091423203710",
    "country": "US",
    "featured": true,
    "portrait": null,
    "notes": "X API confirms: quoted of status 2098762091423203710 (post-layoffai-2098762091423203710).",
    "status": "verified",
    "verified_at": "2026-09-17"
  },
  {
    "id": "amp-elon-musk-2034731489318048232",
    "entity_type": "person",
    "entity_name": "Elon Musk",
    "role": "Technology executive",
    "organization": null,
    "category": "business",
    "action": "reply",
    "date": "2026-03-19",
    "platform": "x",
    "account": "@elonmusk",
    "evidence_url": "https://x.com/elonmusk/status/2034731489318048232",
    "related_post_id": "post-layoffai-2034123649939079593",
    "country": "US",
    "featured": true,
    "portrait": null,
    "notes": "X API confirms: replied_to of status 2034123649939079593 (post-layoffai-2034123649939079593).",
    "status": "verified",
    "verified_at": "2026-09-17"
  },
  {
    "id": "amp-ansem-2096379852731400569",
    "entity_type": "person",
    "entity_name": "Ansem",
    "role": "Crypto trader and online creator",
    "organization": null,
    "category": "public_figure",
    "action": "quote_post",
    "date": "2026-09-05",
    "platform": "x",
    "account": "@blknoiz06",
    "evidence_url": "https://x.com/blknoiz06/status/2096379852731400569",
    "related_post_id": "post-layoffai-2096250047679574269",
    "country": "US",
    "featured": false,
    "portrait": null,
    "notes": "Public X mirrors show Ansem responding 'how?' while carrying the LayoffHedge August jobs post.",
    "status": "verified",
    "verified_at": "2026-09-16"
  },
  {
    "id": "amp-marjorie-taylor-greene-2087563043718811808",
    "entity_type": "person",
    "entity_name": "Marjorie Taylor Greene",
    "role": "Former U.S. Representative, Georgia's 14th District",
    "organization": null,
    "category": "politics",
    "action": "quote_post",
    "date": "2026-08-12",
    "platform": "x",
    "account": "@FmrRepMTG",
    "evidence_url": "https://x.com/FmrRepMTG/status/2087563043718811808",
    "related_post_id": "post-layoffai-2087170419027526094",
    "country": "US",
    "featured": true,
    "portrait": null,
    "notes": "Duplicate URL supplied twice in the raw list; stored once. Public mirrors show the LayoffHedge H-1B district post embedded beneath her post.",
    "status": "verified",
    "verified_at": "2026-09-16"
  },
  {
    "id": "amp-ron-desantis-2071415432087474481",
    "entity_type": "person",
    "entity_name": "Ron DeSantis",
    "role": "Governor of Florida",
    "organization": "State of Florida",
    "category": "politics",
    "action": "quote_post",
    "date": "2026-06-29",
    "platform": "x",
    "account": "@RonDeSantis",
    "evidence_url": "https://x.com/RonDeSantis/status/2071415432087474481",
    "related_post_id": null,
    "country": "US",
    "featured": true,
    "portrait": null,
    "notes": "X API confirms: quoted of status 2071406948411416696, an @LayoffAI reply addressed to @RonDeSantis about public universities and H-1B hiring (roughly 206,000 views observed by the maintainer). That reply is not tracked as an archive post, so related_post_id stays null.",
    "status": "verified",
    "verified_at": "2026-09-16"
  },
  {
    "id": "amp-warren-davidson-2087206639388516779",
    "entity_type": "person",
    "entity_name": "Warren Davidson",
    "role": "U.S. Representative, Ohio's 8th District",
    "organization": "U.S. House of Representatives",
    "category": "politics",
    "action": "quote_post",
    "date": "2026-08-11",
    "platform": "x",
    "account": "@Rep_Davidson",
    "evidence_url": "https://x.com/Rep_Davidson/status/2087206639388516779",
    "related_post_id": "post-layoffai-2086800985079562516",
    "country": "US",
    "featured": true,
    "portrait": null,
    "notes": "Public mirror shows Davidson commenting on LayoffHedge's congressional-district H-1B analysis. X API confirms: quoted of status 2086800985079562516, now tracked as post-layoffai-2086800985079562516.",
    "status": "verified",
    "verified_at": "2026-09-16"
  },
  {
    "id": "amp-keith-self-2087613115152113689",
    "entity_type": "person",
    "entity_name": "Keith Self",
    "role": "U.S. Representative, Texas's 3rd District",
    "organization": "U.S. House of Representatives",
    "category": "politics",
    "action": "quote_post",
    "date": "2026-08-12",
    "platform": "x",
    "account": "@RepKeithSelf",
    "evidence_url": "https://x.com/RepKeithSelf/status/2087613115152113689",
    "related_post_id": "post-layoffai-2087170419027526094",
    "country": "US",
    "featured": true,
    "portrait": null,
    "notes": "X API confirms: quoted of status 2087170419027526094 (post-layoffai-2087170419027526094).",
    "status": "verified",
    "verified_at": "2026-09-17"
  },
  {
    "id": "amp-chip-roy-2087643804186657243",
    "entity_type": "person",
    "entity_name": "Chip Roy",
    "role": "U.S. Representative, Texas's 21st District",
    "organization": "U.S. House of Representatives",
    "category": "politics",
    "action": "quote_post",
    "date": "2026-08-12",
    "platform": "x",
    "account": "@RepChipRoy",
    "evidence_url": "https://x.com/RepChipRoy/status/2087643804186657243",
    "related_post_id": "post-layoffai-2087170419027526094",
    "country": "US",
    "featured": true,
    "portrait": null,
    "notes": "X API confirms: quoted of status 2087170419027526094 (post-layoffai-2087170419027526094).",
    "status": "verified",
    "verified_at": "2026-09-17"
  },
  {
    "id": "amp-brandon-gill-2087634340632998361",
    "entity_type": "person",
    "entity_name": "Brandon Gill",
    "role": "U.S. Representative, Texas's 26th District",
    "organization": "U.S. House of Representatives",
    "category": "politics",
    "action": "quote_post",
    "date": "2026-08-12",
    "platform": "x",
    "account": "@realBrandonGill",
    "evidence_url": "https://x.com/realBrandonGill/status/2087634340632998361",
    "related_post_id": "post-layoffai-2087170419027526094",
    "follower_count": null,
    "follower_count_observed_at": null,
    "country": "US",
    "featured": false,
    "portrait": null,
    "notes": "Surfaced through a Breitbart article that embeds the post. X API confirms: quoted of status 2087170419027526094 (post-layoffai-2087170419027526094).",
    "status": "verified",
    "verified_at": "2026-09-17"
  }
]
